{
  "version": "v0.2.0",
  "frozen_at": "2026-05-26T00:00:00Z",
  "folios": [
    {
      "id": "leningrad_devarim_f237b",
      "manuscript": "leningrad",
      "book": "devarim",
      "folio": "F237B",
      "image_url": "https://iiif.archive.org/iiif/Leningrad_Codex_Color_Images/f237b.json",
      "iaa_folio": true,
      "in_frozen_scope": true,
      "gt_hash": "c8bbdbb41d01a4fe"
    },
    {
      "id": "leningrad_devarim_f238a",
      "manuscript": "leningrad",
      "book": "devarim",
      "folio": "F238A",
      "image_url": "https://iiif.archive.org/iiif/Leningrad_Codex_Color_Images/f238a.json",
      "iaa_folio": false,
      "in_frozen_scope": true,
      "gt_hash": "f0beffe2ec8df84b"
    }
  ],
  "iaa_subset": ["leningrad_devarim_f237b"],
  "fuses_fired": [],
  "baselines_seeded": ["llm_vision", "biblia_kraken", "biblia_nakdimon", "biblia_char_menaked"],
  "expected_reports_per_baseline": {
    "llm_vision": 2,
    "biblia_kraken": 2,
    "biblia_nakdimon": 2,
    "biblia_char_menaked": 2
  },
  "expected_total_reports": 8,
  "scorer_version": "0.1.0",
  "nakdimon_model_hash": "8fd7722b8002a690",
  "kraken_model_hash": "8514a0c7cc2b5b45",
  "dictabert_model_revision": "d311fbf7c403e50b040440e4859ac78064d025d0",
  "cost_caps_usd": {
    "per_folio": 5.0,
    "per_run": 30.0
  },
  "manifest_changelog": [
    {
      "prev_frozen_at": "2026-05-25T00:00:00Z",
      "new_frozen_at": "2026-05-26T00:00:00Z",
      "reason": "phase 03.3: sample manifest fixture"
    }
  ],
  "baselines": {}
}
