{
  "baselines": {},
  "baselines_seeded": [],
  "cost_caps_usd": {
    "per_folio": 5.0,
    "per_run": 30.0
  },
  "dictabert_model_revision": "d311fbf7c403e50b040440e4859ac78064d025d0",
  "expected_reports_per_baseline": {
    "biblia_char_menaked": 0,
    "biblia_kraken": 0,
    "biblia_nakdimon": 0,
    "llm_vision": 0
  },
  "expected_total_reports": 0,
  "folios": [
    {
      "book": "devarim",
      "folio": "F118B",
      "gt_hash": "4b7bc5bea20bb201",
      "iaa_folio": true,
      "id": "leningrad_devarim_F118B_fixture",
      "image_url": "https://archive.org/download/leningrad-codex-color/BIB_LENCDX_F118B.jpg",
      "in_frozen_scope": true,
      "manuscript": "leningrad",
      "gt_source": "iaa_data/devarim_4folio/goldens/leningrad_devarim_F118B_fixture.gt_adapter_golden.json@4b96e57 (projection of iaa_data/devarim_4folio/consensus_gold_positional.json@3ece579)"
    },
    {
      "book": "devarim",
      "folio": "F119A",
      "gt_hash": "349c49877b364686",
      "iaa_folio": true,
      "id": "leningrad_devarim_F119A_fixture",
      "image_url": "https://archive.org/download/leningrad-codex-color/BIB_LENCDX_F119A.jpg",
      "in_frozen_scope": true,
      "manuscript": "leningrad",
      "gt_source": "iaa_data/devarim_4folio/goldens/leningrad_devarim_F119A_fixture.gt_adapter_golden.json@4b96e57 (projection of iaa_data/devarim_4folio/consensus_gold_positional.json@3ece579)"
    },
    {
      "book": "devarim",
      "folio": "F119B",
      "gt_hash": "ad05144923c1d8b8",
      "iaa_folio": true,
      "id": "leningrad_devarim_F119B_fixture",
      "image_url": "https://archive.org/download/leningrad-codex-color/BIB_LENCDX_F119B.jpg",
      "in_frozen_scope": true,
      "manuscript": "leningrad",
      "gt_source": "iaa_data/devarim_4folio/goldens/leningrad_devarim_F119B_fixture.gt_adapter_golden.json@4b96e57 (projection of iaa_data/devarim_4folio/consensus_gold_positional.json@3ece579)"
    },
    {
      "book": "devarim",
      "folio": "F120A",
      "gt_hash": "df44bf6579beefe2",
      "iaa_folio": true,
      "id": "leningrad_devarim_F120A_fixture",
      "image_url": "https://archive.org/download/leningrad-codex-color/BIB_LENCDX_F120A.jpg",
      "in_frozen_scope": true,
      "manuscript": "leningrad",
      "gt_source": "iaa_data/devarim_4folio/goldens/leningrad_devarim_F120A_fixture.gt_adapter_golden.json@4b96e57 (projection of iaa_data/devarim_4folio/consensus_gold_positional.json@3ece579)"
    }
  ],
  "frozen_at": "2026-07-29T13:00:31Z",
  "fuses_fired": [],
  "iaa_subset": [
    "leningrad_devarim_F118B_fixture",
    "leningrad_devarim_F119A_fixture",
    "leningrad_devarim_F119B_fixture",
    "leningrad_devarim_F120A_fixture"
  ],
  "kraken_model_hash": "8514a0c7cc2b5b45",
  "manifest_changelog": [
    {
      "new_frozen_at": "2026-04-29T02:41:41Z",
      "prev_frozen_at": "2026-04-25T16:30:44Z",
      "reason": "phase 03.1 W3.5: import from baalshem@bc7255ecaa3eb872885467d3a59e9e6352d5668a; values preserved verbatim"
    },
    {
      "new_frozen_at": "2026-04-29T02:42:08Z",
      "prev_frozen_at": "2026-04-29T02:41:41Z",
      "reason": "phase 03.1 W3.5: regime change — reset expected_reports_per_baseline.* to 0 + seed cost_caps_usd ahead of W4 promotions (A-01-amended D-14 + A-02 lock)"
    },
    {
      "new_frozen_at": "2026-04-30T13:21:24Z",
      "prev_frozen_at": "2026-04-29T02:42:08Z",
      "reason": "phase 03.2: IAA set finalized to last 4 sides of L Devarim per Yosef 2026-04-30"
    },
    {
      "new_frozen_at": "2026-04-30T17:00:00Z",
      "prev_frozen_at": "2026-04-30T13:21:24Z",
      "reason": "phase 03.2: populate iaa_subset with the 4 IAA folio IDs (follow-up — original fuse missed the explicit array; per-folio iaa_folio=true was set but iaa_subset stayed []; masoretic_eval/manifest.py reads the explicit array)"
    },
    {
      "new_frozen_at": "2026-04-30T19:58:28Z",
      "prev_frozen_at": "2026-04-30T17:00:00Z",
      "reason": "phase 3.1: biblia_kraken leningrad_devarim_F118B_fixture promoted"
    },
    {
      "new_frozen_at": "2026-04-30T22:56:48Z",
      "prev_frozen_at": "2026-04-30T19:58:28Z",
      "reason": "phase 3.1: llm_vision leningrad_devarim_F118B_fixture promoted"
    },
    {
      "new_frozen_at": "2026-05-01T02:19:06Z",
      "prev_frozen_at": "2026-04-30T22:56:48Z",
      "reason": "phase 03.1: evaluation protocol pre-registered per BL-07 (whole-folio macro-averaged CER tiers 1-3 / F1 tier 4 as headline; per-line CER, zone-restricted CER, segmentation-merge variants deferred to v0.2 pending IAA). Scoring methodology frozen in baselines/EVALUATION_PROTOCOL.md."
    },
    {
      "new_frozen_at": "2026-05-01T03:18:50Z",
      "prev_frozen_at": "2026-05-01T02:19:06Z",
      "reason": "phase 3.1: biblia_char_menaked leningrad_devarim_F118B_fixture promoted"
    },
    {
      "new_frozen_at": "2026-05-01T06:36:29Z",
      "prev_frozen_at": "2026-05-01T03:18:50Z",
      "reason": "phase 3.1: biblia_nakdimon leningrad_devarim_F118B_fixture promoted"
    },
    {
      "new_frozen_at": "2026-06-11T19:30:00Z",
      "prev_frozen_at": "2026-05-01T06:36:29Z",
      "reason": "phase 03.3: Step 2b maqaf-convention unification — tier-1 maqaf U+05BE retained, no trailing space (DECISIONS.md 2026-06-11). GT regenerated to bare maqaf across the 4 PAGE-XML exports + the 4 gt_adapter goldens; the F118B hand golden kept its 26 physical lines with 25 within-line codex maqafs injected by UXLC alignment (4 line-break-straddling joins left as line breaks); false UXLC-derived provenance corrected. results/scores/leningrad_devarim_F118B_fixture.json re-emitted from the corrected GT (real re-run): biblia_kraken 0.9162->0.9282, llm_vision 0.6662->0.6613, biblia_nakdimon/biblia_char_menaked 0.5965->0.6106, ranking preserved (nakdimon<llm_vision<kraken); gt_chars_normalized off-by-one 1421->1420 fixed. baselines/EVALUATION_PROTOCOL.md gains a paired methodology-table row. Per-folio gt_hash stays null (GT remains pre-Yosef-review/provisional)."
    },
    {
      "prev_frozen_at": "2026-06-11T19:30:00Z",
      "new_frozen_at": "2026-07-10T14:23:18Z",
      "reason": "phase 04: v0.1 gt_hash fuse (Option A). Per-folio gt_hash = sha256[:16] of iaa_data/devarim_4folio/goldens/<folio>.gt_adapter_golden.json@4b96e57, each a projection of consensus_gold_positional.json@3ece579 (Ginsberg A + Moster B, adjudicated 2026-06-19). gt_source records the covered file. D-28's adjudicated_gt_<folio>.json was never produced, hence the projection. scorer_version corrected 0.1.0 -> 0.2.0 (stale since 0a58c1d, 2026-04-26). This field is not inert: baselines/src/baselines/_base.py cascades it into every emitted run_meta.json, so the four promoted run_meta.json files recorded scorer_version 0.1.0 even though each pins a sibling_git_sha at which masoretic_eval.__version__ was already 0.2.0. Correcting those emitted records is a separate change; no score depends on this field."
    },
    {
      "prev_frozen_at": "2026-07-10T14:23:18Z",
      "new_frozen_at": "2026-07-10T16:05:00Z",
      "reason": "phase 04: v0.1 Option A - automated baselines withdrawn to v0.1.1. results/ and results_provisional/ removed from the public tree. The F118B whole-folio scores are RETRACTED: they were computed over 109 Kraken lines (incl. masorah magna/parva apparatus) against 26 physical main-text GT lines, with all bboxes [0,0,0,0] so reading order fell back to line_id. The resulting ranking is inverted - biblia_kraken is reported worst (tier1 0.9282) when ROI-restricted main-text scoring puts it best on consonants. Separately, the biblia_char_menaked tier-2/3 predictions are corrupt (unpinned transformers produced cumulative prefix repetition: tier2 3.3x tier1, nikkud on 7 of 109 lines); they are not model output and are not publishable with a caveat. expected_reports_per_baseline reset to 0; re-promote in v0.1.1 from real re-runs under pinned transformers and ROI/main-text methodology."
    },
    {
      "prev_frozen_at": "2026-07-10T16:05:00Z",
      "new_frozen_at": "2026-07-29T13:00:31Z",
      "reason": "phase 04: v0.1.1 scorer_version corrected 0.2.0 -> 0.3.0. The scorer took a BREAKING tier-4 vocabulary bump to 0.3.0 in pyproject.toml, but masoretic_eval/__init__.py::__version__ and this field both stayed at 0.2.0, so the installed package reported a version its own metadata contradicted. The field is not inert: masoretic_eval/output_schema.py stamps __version__ into every emitted result and scripts/verify_gt_hash.py writes it here, from which baselines/src/baselines/_base.py cascades it into every run_meta.json. No run_meta.json is published under v0.1 (Option A), so nothing downstream recorded the stale value this time -- unlike the 0.1.0 -> 0.2.0 correction above, which had already contaminated four promoted records. The guard that should have caught this, tests/test_scorer_version_cascade.py::test_manifest_scorer_version_matches_the_package, was VACUOUS: it compared this field to __version__ with both ends equally stale and nothing tying either to pyproject. It now asserts importlib.metadata.version == __version__ == scorer_version. No score, hash or published figure depends on this field."
    }
  ],
  "nakdimon_model_hash": "8fd7722b8002a690",
  "scorer_version": "0.3.0",
  "version": "v0.2.0"
}
